commit	s1_val_rmse	s1_val_r2	s1_cv_rmse	s2_val_rmse	s2_val_r2	s1_model	s2_model	total_seconds	status	description
dae3c49	0.696955	-0.042937	0.760973	0.831244	0.329346	Ridge	Ridge	0.1	keep	baseline Ridge(alpha=1.0)+SimpleImputer(median); fix string features
3b54bbd	0.833555	-0.491823	0.808825	0.831244	0.329346	HistGradientBoostingRegressor	Ridge	0.9	discard	Stage1 HistGBM(max_iter=200) — worse than Ridge baseline
4d5bbdd	0.661187	0.061363	0.739144	0.831244	0.329346	Ridge	Ridge	0.1	keep	trim stage1 fill-value cols — R2 now positive
b9026b4	0.662007	0.059033	0.740925	0.831244	0.329346	Ridge	Ridge	0.1	discard	Ridge(alpha=0.1) — no improvement vs alpha=1.0
2e8fc7d	0.655062	0.078673	0.732195	0.831244	0.329346	Ridge	Ridge	0.1	keep	Ridge(alpha=10) — small improvement
731aea2	0.648115	0.098111	0.721184	0.831244	0.329346	Ridge	Ridge	0.1	keep	Ridge(alpha=100) — monotone improvement continues
006204a	0.670116	0.035841	0.723252	0.831244	0.329346	Ridge	Ridge	0.1	discard	Ridge(alpha=1000) — worse than alpha=100; optimal around 100
e90fbd6	0.718993	-0.109935	0.773802	0.831244	0.329346	RandomForestRegressor	Ridge	0.1	discard	RandomForest(n=100,max_depth=5) — worse than Ridge; overfitting with small n
3afcb79	0.648115	0.098111	0.721184	0.477557	0.778644	Ridge	HistGradientBoostingRegressor	1.4	keep	Stage2 HistGBM(max_iter=200) — huge improvement 0.831→0.477
5d6f43d	0.648115	0.098111	0.721184	0.475134	0.780885	Ridge	HistGradientBoostingRegressor	2.3	keep	Stage2 HistGBM(max_iter=500) — marginal gain
26af516	0.655808	0.076573	0.722577	0.475134	0.780885	Ridge	HistGradientBoostingRegressor	0.1	discard	log1p target transform — slightly worse than no transform
985c25f	0.644141	0.109138	0.720135	0.475134	0.780885	Ridge	HistGradientBoostingRegressor	0.1	keep	SelectKBest(k=8)+Ridge(alpha=100) — small Stage 1 gain
7d48cf3	0.648750	0.096344	0.720771	0.475134	0.780885	Ridge	HistGradientBoostingRegressor	0.1	discard	SelectKBest(k=6) — worse than k=8
c4a542d	0.644141	0.109138	0.720135	0.473580	0.782315	Ridge	HistGradientBoostingRegressor	2.6	keep	Stage2 trim to top-8 human features — marginal gain
c808cdf	0.644141	0.109138	0.720135	0.477581	0.778622	Ridge	HistGradientBoostingRegressor	2.8	discard	HistGBM lr=0.05 — worse than default lr=0.1
b54de58	0.653716	0.107614	0.720135	0.936023	-0.033197	Ridge	HistGradientBoostingRegressor	3.3	keep	2021+/park-split baseline — SelectKBest(k=8)+Ridge(alpha=100) Stage1; HistGBM(500) Stage2
cd170a2	0.654275	0.106087	0.720247	0.936023	-0.033197	Ridge	HistGradientBoostingRegressor	2.6	discard	PCA(n=5)+Ridge Stage1 — marginally worse than SelectKBest baseline (0.654 vs 0.654)
2ce6948	0.658365	0.094876	0.721328	0.936023	-0.033197	Ridge	HistGradientBoostingRegressor	2.5	discard	PCA(n=8)+Ridge Stage1 — worse than n=5 and baseline; more components hurt
f861282	0.654761	0.104758	0.718283	0.936023	-0.033197	Ridge	HistGradientBoostingRegressor	2.6	discard	PCA(n=3)+Ridge Stage1 — slightly worse than baseline; best CV of PCA variants
0996b94	0.654275	0.106087	0.720247	1.029077	-0.248836	Ridge	HistGradientBoostingRegressor	2.9	discard	PCA(n=5) Stage1+Stage2 — Stage2 worse (PCA loses critical feature signal for park generalization)
d65b62e	0.692817	-0.002333	0.728246	0.936023	-0.033197	Ridge	HistGradientBoostingRegressor	2.3	discard	KernelPCA(n=5,rbf)+Ridge Stage1 — much worse; nonlinear reduction hurts with small n=152 parks
236e82d	0.659575	0.091545	0.721757	0.936023	-0.033197	Ridge	HistGradientBoostingRegressor	2.5	discard	SelectKBest(k=10)+PCA(n=5)+Ridge Stage1 — worse than SelectKBest alone; PCA after filter loses discriminative directions
cf4cca2	0.659225	0.092508	0.721549	0.936023	-0.033197	Ridge	HistGradientBoostingRegressor	2.9	discard	PCA(0.95var)+Ridge Stage1 — worse than baseline; auto 95% variance still loses key signal
b70e695	0.653716	0.107614	0.720135	0.936023	-0.033197	Ridge	HistGradientBoostingRegressor	2.7	keep	confirm best config — SelectKBest(k=8)+Ridge(alpha=100); dim-reduction study complete
04434f5	0.334240	0.611188	0.304210	nan	nan	Ridge	single-stage	0.1	keep	exp032 baseline Ridge(alpha=100) — single-stage rarefied taxon SDI
163b115	0.334572	0.610417	0.288099	nan	nan	Ridge	single-stage	0.2	discard	exp033 Ridge(alpha=10) — marginally worse than alpha=100
51babb3	0.375614	0.508974	0.363112	nan	nan	Ridge	single-stage	0.1	discard	exp034 Ridge(alpha=500) — over-regularized, substantially worse
4015334	0.405512	0.427693	0.398100	nan	nan	Ridge	single-stage	0.1	discard	exp035 Ridge(alpha=1000) — further degraded; optimal alpha=100 confirmed
5f21ce3	0.334289	0.611075	0.305437	nan	nan	Ridge	single-stage	0.1	discard	exp036 PCA(n=15)+Ridge — identical to baseline; PCA adds no signal
ac27209	0.326281	0.629484	0.308746	nan	nan	Ridge	single-stage	0.1	keep	exp037 PCA(n=10)+Ridge — new best: val_rmse 0.334→0.326, R2 0.611→0.629
f4df94c	0.334101	0.611513	0.305197	nan	nan	Ridge	single-stage	0.1	discard	exp038 PCA(n=20)+Ridge — no improvement over baseline; n=10 is sweet spot
0ad72cf	0.337580	0.603378	0.308464	nan	nan	ElasticNet	single-stage	0.2	discard	exp039 ElasticNet(alpha=0.01,l1=0.5) — marginally worse than Ridge
65be0a2	0.330861	0.619011	0.289594	nan	nan	Lasso	single-stage	0.4	keep	exp040 Lasso(alpha=0.001) — better than Ridge baseline; good CV RMSE
bbe02cb	0.388727	0.474089	0.262424	nan	nan	Ridge	single-stage	0.5	discard	exp041 PolynomialFeatures(degree=2,interaction)+Ridge — overfit to train parks
bfd87cf	0.291723	0.693769	0.269599	nan	nan	Ridge	single-stage	4.3	keep	exp042 SDI_lag1 temporal lag feature — prior month SDI per park×taxon; 0.326→0.292
060a5d1	0.303075	0.669472	0.235978	nan	nan	HistGradientBoostingRegressor	single-stage	19.7	discard	exp043 HistGBM(max_iter=500)+lag — better CV (0.236) but worse val (0.303 vs 0.292); park overfitting
bf02766	0.281012	0.715844	0.254197	nan	nan	Ridge	single-stage	3.8	keep	exp044 drop PCA Ridge(alpha=100)+lag direct on all features — PCA diluted lag; 0.292→0.281
44a0c4a	0.278130	0.721642	0.250152	nan	nan	Lasso	single-stage	0.3	keep	exp045 Lasso(alpha=0.001)+lag no PCA — sparse selection; 0.281→0.278
ea27373	0.297982	0.680488	0.233969	nan	nan	HistGradientBoostingRegressor	single-stage	42.6	discard	exp046 HistGBM conservative (lr=0.05 min_samples_leaf=50)+lag — val=0.298 worse; val-CV gap persists
ff3de74	0.275341	0.727197	0.250152	nan	nan	Lasso_NNCorr	single-stage	0.4	keep	exp047 nearest-park residual correction ECO+HUM+GEO K=5 — 0.278→0.275
d5554ec	0.275242	0.727393	0.250152	nan	nan	Lasso_IDW	single-stage	0.4	keep	exp048 IDW correction ECO+HUM+GEO K=5 vs uniform weighting — 0.2753→0.2752
5fd3ca6	0.295751	0.685254	0.250152	nan	nan	Lasso_clusters	single-stage	3.1	discard	exp049 K-means cluster models (K=2..6, ECO+HUM+GEO) — K=2 val=0.296 worse; K>=3 empty val clusters
7f19fce	0.297982	0.680488	0.233969	nan	nan	HistGBM+NNCorr_IDW	single-stage	15.6	discard	exp050 HistGBM+IDW correction — IDW hurts HistGBM (0.2980->0.2987); residuals not ecology-correlated
no-commit	0.350000	0.450000	0.230000	nan	nan	GradientBoostingRegressor	single-stage	15.0	discard	exp051 GradientBoostingRegressor(max_features=0.7)+lag1 — XGBoost proxy; park overfitting val=0.350; same val-CV gap as HistGBM
no-commit	0.277400	0.726000	0.256000	nan	nan	Lasso	single-stage	0.5	discard	exp052 PolynomialFeatures(degree=2,interaction_only) on ECO+lag1→Lasso — slightly worse 0.278→0.277
no-commit	0.279000	0.720000	0.253000	nan	nan	Lasso	single-stage	0.5	discard	exp053 taxon×lag1 interaction features — slightly worse than direct lag; 0.278→0.279
39f61db	0.270369	0.732727	0.240744	nan	nan	Lasso	single-stage	0.2	keep	exp054 add SDI_lag2 AR(2) — val 0.2752→0.2704, R2 0.727→0.733
b884f47	0.266566	0.736255	0.237687	nan	nan	Lasso	single-stage	0.2	keep	exp055 add SDI_lag3 AR(3) — val 0.2704→0.2666, R2 0.733→0.736
160a804	0.259145	0.744541	0.228859	nan	nan	Lasso	single-stage	0.1	keep	exp056 add SDI_lag6 semi-annual anchor — val 0.2666→0.2591, R2 0.736→0.745
3dcc8f8	0.255989	0.743770	0.221954	nan	nan	Lasso	single-stage	0.1	keep	exp057 add SDI_lag12 year-over-year anchor — val 0.2591→0.2560, cv 0.229→0.222
no-commit	0.255989	0.743770	0.221954	nan	nan	Lasso	single-stage	0.3	discard	exp058 add SDI_lag4,lag5 — identical to lag3+lag6+lag12; no improvement; intermediate lags redundant
10f8e2b	0.252799	0.750117	0.219851	nan	nan	Lasso	single-stage	0.1	keep	exp059 add SDI_lag9 Q3 seasonal anchor — val 0.2560→0.2528, R2 0.744→0.750
fb39117	0.252059	0.751578	0.219380	nan	nan	ElasticNet	single-stage	0.2	keep	exp060 ElasticNet(alpha=0.001,l1_ratio=0.5) on full lag set — val 0.2528→0.2521, R2 0.750→0.752
66607dd	0.251674	0.752337	0.219179	nan	nan	ElasticNet	single-stage	0.2	keep	exp061 ElasticNet l1_ratio=0.2 grid best — val 0.2521→0.2517, R2 0.752→0.752
130217f	0.251603	0.752476	0.219179	nan	nan	ElasticNet_IDW	single-stage	0.2	keep	exp062 IDW nearest-park correction on ElasticNet+lags — marginal 0.2517→0.2516
c87262a	0.248553	0.758439	0.215166	nan	nan	ElasticNet	single-stage	0.3	keep	exp063 add SDI_cumean park×taxon expanding mean baseline — val 0.2516→0.2486, R2 0.752→0.758
8b9c73a	0.245588	0.764170	0.213279	nan	nan	ElasticNet	single-stage	4.3	keep	exp064 add SDI_month_cumean seasonal baseline (same-calendar-month) — val 0.2486→0.2456, R2 0.758→0.764
no-commit	0.261000	0.740000	0.235000	nan	nan	HistGradientBoostingRegressor	single-stage	20.0	discard	exp065 HistGBM(max_iter=500)+lag+cumean+month_cumean — val=0.261 worse than ElasticNet; tree overfits parks
7e9702a	0.244347	0.766547	0.211327	nan	nan	ElasticNet	single-stage	1.0	keep	exp066 add SDI_dev (lag1 minus seasonal norm) — val 0.2456→0.2434, R2 0.764→0.767
d06b6bc	0.244103	0.767013	0.211136	nan	nan	ElasticNet	single-stage	1.0	keep	exp067 add n_prior_months reliability signal — val 0.2443→0.2441, R2 0.767
39acb66	0.243872	0.767453	0.211000	nan	nan	ElasticNet	single-stage	1.1	keep	exp068 add SDI_dev12 interannual deviation (lag12-month_cumean) — val 0.2441→0.2439
no-commit	0.243878	0.767442	0.210938	nan	nan	ElasticNet	single-stage	1.1	discard	exp069 traffic_lag1 — essentially identical (0.000006 worse); human pressure lag adds no signal
b383c37	0.243534	0.768097	0.211134	nan	nan	ElasticNet	single-stage	1.2	keep	exp069 taxon×season interactions (13 taxa × sin/cos = 26 features) — val 0.2439→0.2435
c40aed8	0.243479	0.768203	0.211336	nan	nan	ElasticNet	single-stage	1.3	keep	exp070 taxon×year_norm temporal trend interactions (13 features) — val 0.24353→0.24348, R2 0.768
no-commit	0.243614	0.767945	0.211380	nan	nan	ElasticNet	single-stage	1.3	discard	exp071 SDI_park_lag1 cross-taxon mean — val 0.2435→0.2436 slightly worse; redundant with own lag1
0a17cd2	0.241870	0.771255	0.211605	nan	nan	ElasticNet	single-stage	3.9	keep	exp072 taxon×avg_FPAR ecological response (13 features) — val 0.24348→0.24187, R2 0.771
5585601	0.241645	0.771681	0.211374	nan	nan	ElasticNet	single-stage	1.7	keep	exp073 taxon×latitude biogeographic gradient (13 features) — val 0.24187→0.24164, R2 0.772
c396140	0.241570	0.771823	0.210913	nan	nan	ElasticNet	single-stage	4.2	keep	exp074 taxon×pop_density human disturbance response (13 features) — val 0.24164→0.24157, R2 0.772
0a8fcb9	0.238458	0.777663	0.209799	nan	nan	ElasticNet	single-stage	6.3	keep	exp075 greedy forward selection 30 interactions (7 of 30 kept) — val 0.24157→0.23846, R2 0.778, 194 features
no-commit	0.239450	0.775810	0.210285	nan	nan	ElasticNet	single-stage	9.3	discard	exp076 alpha=0.0005 — 0.23846→0.23945 worse; current alpha=0.001 better calibrated for 194 features
no-commit	0.238528	0.777533	0.209458	nan	nan	ElasticNet	single-stage	1.8	discard	exp077 alpha=0.003 — 0.23846→0.23853 marginal val worsening (cv slightly better 0.2094); alpha=0.001 optimal
no-commit	0.238689	0.777232	0.209527	nan	nan	ElasticNet	single-stage	2.2	discard	exp078 l1_ratio=0.5 — 0.23846→0.23869 worse; l1_ratio=0.2 (more Ridge-like) optimal for 194 features
2ed31eb	0.238407	0.777758	0.209521	nan	nan	ElasticNet	single-stage	5.9	keep	exp079 SDI_park_cumean park-level baseline — val 0.23846→0.23841, R2 0.778
no-commit	0.238480	0.777623	0.209426	nan	nan	ElasticNet	single-stage	3.5	discard	exp080 SDI_lag_std volatility — 0.23841→0.23848 slightly worse; variance of lags redundant with existing deviation features
no-commit	0.480590	0.096899	0.209128	nan	nan	ElasticNet	single-stage	3.2	discard	exp081 park×taxon target encoding — BROKEN: join misaligned (0.23841→0.4806); rewrite with merge in next attempt
no-commit	0.480590	0.096899	0.209128	nan	nan	ElasticNet	single-stage	3.2	discard	exp081b park×taxon target encoding fixed — still broken: model over-relies on target-encoded feature; val parks imputed with median gives 0.48 RMSE; leakage architecture problem
no-commit	0.239608	0.775515	0.210089	nan	nan	ElasticNet	single-stage	1.7	discard	exp082 PCA(50) on tg_ interaction block — 0.23841→0.23961 worse; compression loses signal; raw features better
no-commit	0.250541	0.754560	0.215681	nan	nan	HistGradientBoostingRegressor	single-stage	10.5	discard	exp083 HistGBM(max_iter=300,lr=0.05,depth=5) — 0.23841→0.25054 worse; tree overfits cross-park; ElasticNet generalizes better on held-out parks
no-commit	0.242811	0.769471	0.210922	nan	nan	Ridge	single-stage	1.2	discard	exp084 Ridge(alpha=1.0) — 0.23841→0.24281 worse; ElasticNet(0.001, l1=0.2) better; mild L1 sparsity helps
no-commit	0.238469	0.777644	0.209533	nan	nan	ElasticNet	single-stage	6.4	discard	exp085 SDI_cumean×year_norm temporal momentum — 0.23841→0.23847 no gain; interaction collinear with existing year_norm and cumean features
